{
  "$schema": "../../../schemas/quant/golden-two-rebalance-v1.schema.json",
  "schema_version": "qme.golden_two_rebalance_fixture.v1",
  "fixture_spec_id": "NEE-116A-GOLDEN-TWO-REBALANCE-V1",
  "data_class": "SYNTHETIC_NON_EMPIRICAL_TEST_ONLY",
  "review": {
    "status": "AWAITING_INDEPENDENT_REVIEW",
    "reviewer_identity": null
  },
  "authority_bindings": {
    "nee_118_spec": {
      "path": "docs/quant/QME_ACCOUNTING_EXECUTION_METRICS_SPEC.md",
      "sha256": "27e906a612eb61a2f12947ff3696cb907d56d883e45c99a7503011fe13bb8840"
    },
    "nee_118_config": {
      "path": "configs/quant/accounting-equations-v1.json",
      "sha256": "decb3d52dea8b4020f011554848bb9a7c6164827cfe319be36fc46c78b8c2e0c"
    },
    "nee_118_executable": {
      "path": "qme/quant/equations.py",
      "sha256": "ac0589b3d4184334a90698196aecd44cf26d43393bafc238c1f6acc1cf80fe83"
    },
    "nee_119_contract": {
      "path": "configs/quant/qme-v0.1-contract.json",
      "sha256": "47070e5827292e74567ae32aeff58bcc2c58e4720edaa2d557435eb2a5f472fa"
    },
    "nee_119_spec": {
      "path": "docs/quant/QME_V0_1_QUANTITATIVE_CONTRACT.md",
      "sha256": "f44fdab28e18f87e159e69587001b4f90b4b0922af9dd1ae628f0271ce8184d1"
    },
    "nee_119_total_return_methodology": {
      "path": "configs/quant/qme-v0.1-total-return-methodology.json",
      "sha256": "95381821c1c8ff00e0e626b3d7ee36466d12c3be9e6b8cb75ee166f0043454ac"
    }
  },
  "units": {
    "currency_quantum": "0.00000001",
    "share_storage_quantum": "0.00000001"
  },
  "evidence_registry": {
    "initial_aaa": {
      "security_id": "AAA", "source_id": "SYNTHETIC_FIXTURE", "snapshot_id": "initial-aaa",
      "snapshot_sha256": "aaaaaaaaaaaaaaaaaaaaaaaaaaaaaaaaaaaaaaaaaaaaaaaaaaaaaaaaaaaaaaaa",
      "calendar_id": "XNAS", "calendar_sha256": "cccccccccccccccccccccccccccccccccccccccccccccccccccccccccccccccc",
      "observation_start_session": "2026-01-02", "observation_end_session": "2026-01-02",
      "available_at": "2026-01-02T21:00:00+00:00", "analysis_as_of": "2026-01-02T22:00:00+00:00"
    },
    "r1_aaa": {
      "security_id": "AAA", "source_id": "SYNTHETIC_FIXTURE", "snapshot_id": "r1-universe",
      "snapshot_sha256": "1111111111111111111111111111111111111111111111111111111111111111",
      "calendar_id": "XNAS", "calendar_sha256": "cccccccccccccccccccccccccccccccccccccccccccccccccccccccccccccccc",
      "observation_start_session": "2026-01-05", "observation_end_session": "2026-01-05",
      "available_at": "2026-01-05T14:31:00+00:00", "analysis_as_of": "2026-01-05T21:00:00+00:00"
    },
    "r1_bbb": {
      "security_id": "BBB", "source_id": "SYNTHETIC_FIXTURE", "snapshot_id": "r1-universe",
      "snapshot_sha256": "1111111111111111111111111111111111111111111111111111111111111111",
      "calendar_id": "XNAS", "calendar_sha256": "cccccccccccccccccccccccccccccccccccccccccccccccccccccccccccccccc",
      "observation_start_session": "2026-01-05", "observation_end_session": "2026-01-05",
      "available_at": "2026-01-05T14:31:00+00:00", "analysis_as_of": "2026-01-05T21:00:00+00:00"
    },
    "action_aaa": {
      "security_id": "AAA", "source_id": "SYNTHETIC_FIXTURE", "snapshot_id": "action-universe",
      "snapshot_sha256": "3333333333333333333333333333333333333333333333333333333333333333",
      "calendar_id": "XNAS", "calendar_sha256": "cccccccccccccccccccccccccccccccccccccccccccccccccccccccccccccccc",
      "observation_start_session": "2026-01-06", "observation_end_session": "2026-01-06",
      "available_at": "2026-01-06T21:00:00+00:00", "analysis_as_of": "2026-01-06T22:00:00+00:00"
    },
    "action_bbb": {
      "security_id": "BBB", "source_id": "SYNTHETIC_FIXTURE", "snapshot_id": "action-universe",
      "snapshot_sha256": "3333333333333333333333333333333333333333333333333333333333333333",
      "calendar_id": "XNAS", "calendar_sha256": "cccccccccccccccccccccccccccccccccccccccccccccccccccccccccccccccc",
      "observation_start_session": "2026-01-06", "observation_end_session": "2026-01-06",
      "available_at": "2026-01-06T21:00:00+00:00", "analysis_as_of": "2026-01-06T22:00:00+00:00"
    },
    "r2_aaa": {
      "security_id": "AAA", "source_id": "SYNTHETIC_FIXTURE", "snapshot_id": "r2-universe",
      "snapshot_sha256": "5555555555555555555555555555555555555555555555555555555555555555",
      "calendar_id": "XNAS", "calendar_sha256": "cccccccccccccccccccccccccccccccccccccccccccccccccccccccccccccccc",
      "observation_start_session": "2026-02-02", "observation_end_session": "2026-02-02",
      "available_at": "2026-02-02T14:31:00+00:00", "analysis_as_of": "2026-02-02T21:00:00+00:00"
    },
    "r2_bbb": {
      "security_id": "BBB", "source_id": "SYNTHETIC_FIXTURE", "snapshot_id": "r2-universe",
      "snapshot_sha256": "5555555555555555555555555555555555555555555555555555555555555555",
      "calendar_id": "XNAS", "calendar_sha256": "cccccccccccccccccccccccccccccccccccccccccccccccccccccccccccccccc",
      "observation_start_session": "2026-02-02", "observation_end_session": "2026-02-02",
      "available_at": "2026-02-02T14:31:00+00:00", "analysis_as_of": "2026-02-02T21:00:00+00:00"
    }
  },
  "policies": {
    "policy_id": "SYNTHETIC-SELL-TAX-V1",
    "policy_sha256": "7777777777777777777777777777777777777777777777777777777777777777",
    "source_id": "SYNTHETIC_FIXTURE_NOT_REGULATORY_AUTHORITY",
    "transaction_cost_rate_bps": "10",
    "transaction_tax_rate_bps": "20",
    "transaction_tax_side": "SELL",
    "transaction_tax_base": "RAW_FILL_NOTIONAL",
    "rounding_mode": "ROUND_HALF_EVEN",
    "currency_quantum": "0.00000001"
  },
  "strategy_common": {
    "initial_state": {
      "cash": "20", "positions": {"AAA": "10"}, "receivables": "0",
      "raw_marks": {"AAA": {"coordinate": "RAW_MARK", "value": "100", "evidence_id": "initial_aaa"}}
    },
    "rebalance_1": {
      "rebalance_id": "strategy-r1",
      "signal_session": {"calendar_id": "XNAS", "calendar_sha256": "cccccccccccccccccccccccccccccccccccccccccccccccccccccccccccccccc", "session_date": "2026-01-02", "ordinal": 100},
      "eligible_session": {"calendar_id": "XNAS", "calendar_sha256": "cccccccccccccccccccccccccccccccccccccccccccccccccccccccccccccccc", "session_date": "2026-01-05", "ordinal": 101},
      "fill_session": {"calendar_id": "XNAS", "calendar_sha256": "cccccccccccccccccccccccccccccccccccccccccccccccccccccccccccccccc", "session_date": "2026-01-05", "ordinal": 101},
      "order_quantum": "1",
      "raw_marks": {
        "AAA": {"coordinate": "RAW_MARK", "value": "100", "evidence_id": "r1_aaa"},
        "BBB": {"coordinate": "RAW_MARK", "value": "50", "evidence_id": "r1_bbb"}
      },
      "trades": [
        {"symbol": "AAA", "delta_raw_shares": "-5", "raw_execution_price": {"coordinate": "RAW_EXECUTION_PRICE", "value": "100", "evidence_id": "r1_aaa"}},
        {"symbol": "BBB", "delta_raw_shares": "10", "raw_execution_price": {"coordinate": "RAW_EXECUTION_PRICE", "value": "50", "evidence_id": "r1_bbb"}}
      ]
    },
    "shared_action_timeline": {
      "session": {"calendar_id": "XNAS", "calendar_sha256": "cccccccccccccccccccccccccccccccccccccccccccccccccccccccccccccccc", "session_date": "2026-01-06", "ordinal": 102},
      "event_order": ["SPLIT", "DIVIDEND_ENTITLEMENT"],
      "applied_event_registry_before": [],
      "split": {"event_id": "strategy-split", "security_id": "AAA", "split_factor": "2.5", "evidence_id": "action_aaa"},
      "dividend": {"event_id": "strategy-dividend", "security_id": "AAA", "share_basis": "POST_SPLIT", "raw_cash_per_share": "2", "evidence_id": "action_aaa"},
      "raw_marks_after_split": {
        "AAA": {"coordinate": "RAW_MARK", "value": "40", "evidence_id": "action_aaa"},
        "BBB": {"coordinate": "RAW_MARK", "value": "50", "evidence_id": "action_bbb"}
      },
      "raw_marks_after_entitlement": {
        "AAA": {"coordinate": "RAW_MARK", "value": "38", "evidence_id": "action_aaa"},
        "BBB": {"coordinate": "RAW_MARK", "value": "50", "evidence_id": "action_bbb"}
      },
      "payment": {
        "event_id": "strategy-payment", "dividend_event_id": "strategy-dividend", "evidence_id": "action_aaa",
        "session": {"calendar_id": "XNAS", "calendar_sha256": "cccccccccccccccccccccccccccccccccccccccccccccccccccccccccccccccc", "session_date": "2026-01-07", "ordinal": 103}
      }
    }
  },
  "strategy_variants": [
    {
      "variant_id": "WHOLE_SHARE_ORDERS_WITH_FRACTIONAL_CUSTODY",
      "rebalance_2": {
        "rebalance_id": "strategy-r2-whole",
        "signal_session": {"calendar_id": "XNAS", "calendar_sha256": "cccccccccccccccccccccccccccccccccccccccccccccccccccccccccccccccc", "session_date": "2026-01-30", "ordinal": 120},
        "eligible_session": {"calendar_id": "XNAS", "calendar_sha256": "cccccccccccccccccccccccccccccccccccccccccccccccccccccccccccccccc", "session_date": "2026-02-02", "ordinal": 121},
        "fill_session": {"calendar_id": "XNAS", "calendar_sha256": "cccccccccccccccccccccccccccccccccccccccccccccccccccccccccccccccc", "session_date": "2026-02-02", "ordinal": 121},
        "order_quantum": "1",
        "raw_marks": {
          "AAA": {"coordinate": "RAW_MARK", "value": "38", "evidence_id": "r2_aaa"},
          "BBB": {"coordinate": "RAW_MARK", "value": "50", "evidence_id": "r2_bbb"}
        },
        "trades": [
          {"symbol": "BBB", "delta_raw_shares": "-4", "raw_execution_price": {"coordinate": "RAW_EXECUTION_PRICE", "value": "50", "evidence_id": "r2_bbb"}},
          {"symbol": "AAA", "delta_raw_shares": "4", "raw_execution_price": {"coordinate": "RAW_EXECUTION_PRICE", "value": "38", "evidence_id": "r2_aaa"}}
        ]
      }
    },
    {
      "variant_id": "FRACTIONAL_CUSTODY_INTEGER_ORDERS",
      "rebalance_2": {
        "rebalance_id": "strategy-r2-fractional",
        "signal_session": {"calendar_id": "XNAS", "calendar_sha256": "cccccccccccccccccccccccccccccccccccccccccccccccccccccccccccccccc", "session_date": "2026-01-30", "ordinal": 120},